[
  {
    "test_id": "SETUP-USER",
    "status": "PASS",
    "classification": "NONE",
    "expected": null,
    "actual": {
      "response_code": 403
    },
    "evidence": {
      "newman_source": "reports\\newman\\report.json",
      "failed_assertions": []
    },
    "needs_human_confirmation": false
  },
  {
    "test_id": "SETUP-ADMIN",
    "status": "PASS",
    "classification": "NONE",
    "expected": null,
    "actual": {
      "response_code": 200
    },
    "evidence": {
      "newman_source": "reports\\newman\\report.json",
      "failed_assertions": []
    },
    "needs_human_confirmation": false
  },
  {
    "test_id": "LOGIN-AI-001",
    "status": "FAIL",
    "classification": "DATA_SETUP_FAILURE",
    "expected": null,
    "actual": {
      "response_code": 403
    },
    "evidence": {
      "newman_source": "reports\\newman\\report.json",
      "failed_assertions": [
        {
          "assertion": "LOGIN-AI-001 - status",
          "error": {
            "name": "AssertionError",
            "index": 1,
            "test": "LOGIN-AI-001 - status",
            "message": "expected response to have status code 200 but got 403",
            "stack": "AssertionError: expected response to have status code 200 but got 403\n   at Object.eval sandbox-script.js:2:3)"
          }
        },
        {
          "assertion": "LOGIN-AI-001 - 1: response contains a non-empty token",
          "error": {
            "name": "AssertionError",
            "index": 2,
            "test": "LOGIN-AI-001 - 1: response contains a non-empty token",
            "message": "expected undefined to be a string",
            "stack": "AssertionError: expected undefined to be a string\n   at Object.eval sandbox-script.js:3:3)"
          }
        },
        {
          "assertion": "LOGIN-AI-001 - 3: response contains user",
          "error": {
            "name": "AssertionError",
            "index": 4,
            "test": "LOGIN-AI-001 - 3: response contains user",
            "message": "expected { Object (error) } to have property 'user'",
            "stack": "AssertionError: expected { Object (error) } to have property 'user'\n   at Object.eval sandbox-script.js:5:3)"
          }
        }
      ]
    },
    "needs_human_confirmation": false
  },
  {
    "test_id": "LOGIN-AI-002",
    "status": "FAIL",
    "classification": "DATA_SETUP_FAILURE",
    "expected": null,
    "actual": {
      "response_code": 403
    },
    "evidence": {
      "newman_source": "reports\\newman\\report.json",
      "failed_assertions": [
        {
          "assertion": "LOGIN-AI-002 - status",
          "error": {
            "name": "AssertionError",
            "index": 1,
            "test": "LOGIN-AI-002 - status",
            "message": "expected response to have status code 200 but got 403",
            "stack": "AssertionError: expected response to have status code 200 but got 403\n   at Object.eval sandbox-script.js:2:4)"
          }
        }
      ]
    },
    "needs_human_confirmation": false
  },
  {
    "test_id": "LOGIN-AI-003",
    "status": "PASS",
    "classification": "NONE",
    "expected": null,
    "actual": {
      "response_code": 401
    },
    "evidence": {
      "newman_source": "reports\\newman\\report.json",
      "failed_assertions": []
    },
    "needs_human_confirmation": false
  },
  {
    "test_id": "LOGIN-AI-004",
    "status": "PASS",
    "classification": "NONE",
    "expected": null,
    "actual": {
      "response_code": 403
    },
    "evidence": {
      "newman_source": "reports\\newman\\report.json",
      "failed_assertions": []
    },
    "needs_human_confirmation": false
  },
  {
    "test_id": "LOGIN-AI-005",
    "status": "PASS",
    "classification": "NONE",
    "expected": null,
    "actual": {
      "response_code": 403
    },
    "evidence": {
      "newman_source": "reports\\newman\\report.json",
      "failed_assertions": []
    },
    "needs_human_confirmation": false
  },
  {
    "test_id": "LOGIN-AI-006",
    "status": "PASS",
    "classification": "NONE",
    "expected": null,
    "actual": {
      "response_code": 401
    },
    "evidence": {
      "newman_source": "reports\\newman\\report.json",
      "failed_assertions": []
    },
    "needs_human_confirmation": false
  },
  {
    "test_id": "LOGIN-AI-007",
    "status": "PASS",
    "classification": "NONE",
    "expected": null,
    "actual": {
      "response_code": 401
    },
    "evidence": {
      "newman_source": "reports\\newman\\report.json",
      "failed_assertions": []
    },
    "needs_human_confirmation": false
  },
  {
    "test_id": "LOGIN-AI-008",
    "status": "PASS",
    "classification": "NONE",
    "expected": null,
    "actual": {
      "response_code": 401
    },
    "evidence": {
      "newman_source": "reports\\newman\\report.json",
      "failed_assertions": []
    },
    "needs_human_confirmation": false
  },
  {
    "test_id": "LOGIN-AI-009",
    "status": "PASS",
    "classification": "NONE",
    "expected": null,
    "actual": {
      "response_code": 401
    },
    "evidence": {
      "newman_source": "reports\\newman\\report.json",
      "failed_assertions": []
    },
    "needs_human_confirmation": false
  },
  {
    "test_id": "LOGIN-AI-010",
    "status": "PASS",
    "classification": "NONE",
    "expected": null,
    "actual": {
      "response_code": 401
    },
    "evidence": {
      "newman_source": "reports\\newman\\report.json",
      "failed_assertions": []
    },
    "needs_human_confirmation": false
  },
  {
    "test_id": "LOGIN-AI-011",
    "status": "PASS",
    "classification": "NONE",
    "expected": null,
    "actual": {
      "response_code": 401
    },
    "evidence": {
      "newman_source": "reports\\newman\\report.json",
      "failed_assertions": []
    },
    "needs_human_confirmation": false
  },
  {
    "test_id": "LOGIN-AI-012",
    "status": "PASS",
    "classification": "NONE",
    "expected": null,
    "actual": {
      "response_code": 401
    },
    "evidence": {
      "newman_source": "reports\\newman\\report.json",
      "failed_assertions": []
    },
    "needs_human_confirmation": false
  },
  {
    "test_id": "LOGIN-AI-013",
    "status": "PASS",
    "classification": "NONE",
    "expected": null,
    "actual": {
      "response_code": 403
    },
    "evidence": {
      "newman_source": "reports\\newman\\report.json",
      "failed_assertions": []
    },
    "needs_human_confirmation": false
  },
  {
    "test_id": "LOGIN-AI-014",
    "status": "PASS",
    "classification": "NONE",
    "expected": null,
    "actual": {
      "response_code": 403
    },
    "evidence": {
      "newman_source": "reports\\newman\\report.json",
      "failed_assertions": []
    },
    "needs_human_confirmation": false
  },
  {
    "test_id": "LOGIN-AI-015",
    "status": "PASS",
    "classification": "NONE",
    "expected": null,
    "actual": {
      "response_code": 403
    },
    "evidence": {
      "newman_source": "reports\\newman\\report.json",
      "failed_assertions": []
    },
    "needs_human_confirmation": false
  },
  {
    "test_id": "LOGIN-AI-016",
    "status": "PASS",
    "classification": "NONE",
    "expected": null,
    "actual": {
      "response_code": 403
    },
    "evidence": {
      "newman_source": "reports\\newman\\report.json",
      "failed_assertions": []
    },
    "needs_human_confirmation": false
  },
  {
    "test_id": "LOGIN-AI-017",
    "status": "PASS",
    "classification": "NONE",
    "expected": null,
    "actual": {
      "response_code": 401
    },
    "evidence": {
      "newman_source": "reports\\newman\\report.json",
      "failed_assertions": []
    },
    "needs_human_confirmation": false
  },
  {
    "test_id": "LOGIN-AI-018",
    "status": "PASS",
    "classification": "NONE",
    "expected": null,
    "actual": {
      "response_code": 401
    },
    "evidence": {
      "newman_source": "reports\\newman\\report.json",
      "failed_assertions": []
    },
    "needs_human_confirmation": false
  },
  {
    "test_id": "LOGIN-AI-019",
    "status": "PASS",
    "classification": "NONE",
    "expected": null,
    "actual": {
      "response_code": 400
    },
    "evidence": {
      "newman_source": "reports\\newman\\report.json",
      "failed_assertions": []
    },
    "needs_human_confirmation": false
  },
  {
    "test_id": "LOGIN-AI-020",
    "status": "FAIL",
    "classification": "DATA_SETUP_FAILURE",
    "expected": null,
    "actual": {
      "response_code": 403
    },
    "evidence": {
      "newman_source": "reports\\newman\\report.json",
      "failed_assertions": [
        {
          "assertion": "LOGIN-AI-020 - status",
          "error": {
            "name": "AssertionError",
            "index": 1,
            "test": "LOGIN-AI-020 - status",
            "message": "expected response to have status code 200 but got 403",
            "stack": "AssertionError: expected response to have status code 200 but got 403\n   at Object.eval sandbox-script.js:2:22)"
          }
        },
        {
          "assertion": "LOGIN-AI-020 - 1: response contains a JWT",
          "error": {
            "name": "AssertionError",
            "index": 2,
            "test": "LOGIN-AI-020 - 1: response contains a JWT",
            "message": "expected undefined to be a string",
            "stack": "AssertionError: expected undefined to be a string\n   at Object.eval sandbox-script.js:3:22)"
          }
        }
      ]
    },
    "needs_human_confirmation": false
  },
  {
    "test_id": "LOGIN-AI-021",
    "status": "PASS",
    "classification": "NONE",
    "expected": null,
    "actual": {
      "response_code": 403
    },
    "evidence": {
      "newman_source": "reports\\newman\\report.json",
      "failed_assertions": []
    },
    "needs_human_confirmation": false
  },
  {
    "test_id": "LOGIN-AI-022",
    "status": "PASS",
    "classification": "NONE",
    "expected": null,
    "actual": {
      "response_code": 403
    },